,Service,Type,Rating,Hires,Price,Zip Code
0,Garzonas Overhead Garage Door LLC,116,5,95,,75207
1,Rios Garage Door,116,5,499,75/consult,75207
2,"Reliant Overhead - Garage Doors, Openers & Gates",116,5,921,1/consult,75207
3,ProLift Garage Doors of Dallas,116,5,15,1/consult,75207
4,DoorCraft Garage Doors LLC,116,5,204,1/consult,75207
5,Family Christian Doors,116,4.5,139,1/consult,75207
6,Professional garage concepts,116,5,12,49/consult,75207
7,My Choice Garage LLC,116,5,8,20/consult,75207
8,Nickerson Garage door repair,116,4,2,,75207
9,DFW All Garage Doors,116,5,125,85/consult,75207
10,"Performance Garage Door Service, LLC",116,5,320,,75207
