,Service,Type,Rating,Hires,Price,Zip Code
0,PREMIER HOME BUILDERS LLC,127,5,30,,70114
1,"Rhino Blast Exterior Cleaning, LLC",127,5,62,,70114
2,First Glass Window Treatment,127,5,125,100,70114
3,Geaux H2o Exterior Cleaning Services,127,5,9,1,70114
4,Natalie Pressure Washing,127,5,3,97,70114
5,Neptune ProWash,127,5,,,70114
6,Lou's pressure washing service LLC,127,5,17,120,70114
7,Strictly Business Pressure and softwashing,127,5,,100,70114
8,Blazing hands pressure washing services LLC,127,5,,100,70114
