,Service,Type,Rating,Hires,Price,Zip Code
0,"Heart Heating, Cooling, Plumbing & Electric",133,4.5,324,39/service,80202
1,Mighty Plumbing and Heating,133,4.5,771,49/service,80202
2,Temperature Select Air LLC.,133,4.5,161,89/service,80202
3,Horizon Appliance & HVAC,133,4.5,340,65/service,80202
4,The Bee Heat & AC,133,5,14,69/service,80202
5,Thin Air HVAC Repair,133,5,103,99/service,80202
6,Quality Home HVAC,133,5,87,50/service,80202
7,Bullseye Plumbing Heating and Air Denver,133,5,14,135/service,80202
8,Kelly Colbert Investments LLC,133,5,,99/service,80202
9,Goodfellas Heating and Cooling Inc.,133,4,67,89/service,80202
