,Service,Type,Rating,Hires,Price,Zip Code
0,Samuel E. Manrique Attorney At Law,339,5,27,"1,923",10007
1,"Law Offices of Jeremias E. Batista, LLC",339,5,21,"1,200",10007
2,Law Office of Seni Popat P.C.,339,5,29,950,10007
3,Karra L. Kingston Esq.,339,5,3,"1,100",10007
4,Legal Disputes Resolved,339,5,15,497,10007
5,Alatsas Law Firm,339,5,,"2,500",10007
6,Law Office of Anthony M. Vassallo,339,5,71,"1,450",10007
7,Legacy Tax & Resolution Services,339,5,,"1,500",10007
8,"Law Office of Cushner & Associates, P.C.",339,5,,"1,800",10007
