,Service,Type,Rating,Hires,Price,Zip Code
0,Mindful Yoga with Paola,481,5,,85/session,33602
1,"XYZ Life Coach, Board-Cert. & Masters Dgr. / JK-FL",481,5,,65/session,33602
2,LucidLotus,481,5,15,60/session,33602
3,Lotus Heart Yoga + Meditation,481,5,6,75/session,33602
4,Divine Grace Healing,481,5,,60/session,33602
5,Surya Namaskar School of Yoga and Massage Therapy,481,5,5,125/session,33602
6,Diamond Healing Acupuncture Corporation,481,5,7,80/session,33602
7,Alta Vista Energy Center-Exciting Updated Profile,481,5,35,100/session,33602
